[
  {
    "key": "AMAZON COM SERVICES",
    "display": "Amazon.com Services LLC",
    "kind": "corporate",
    "classification": "corporate_domestic",
    "relation_class": null,
    "relation_basis": null,
    "variants": [
      "Amazon.com Services LLC"
    ],
    "signals": [],
    "roles": {
      "grantee": 1
    },
    "parcels": [
      "46-1300-04-001.005"
    ],
    "addresses": [
      "MCCLAIN RD"
    ],
    "sources": [
      "data/reference/usaspending/awards.yaml",
      "recorder/202511180011830-amazon-deed.deed.yaml"
    ],
    "lei": null,
    "uei": "TMKBFBRHFKH3",
    "federal_obligations": 726730.83
  },
  {
    "key": "BISTROZZI",
    "display": "Bistrozzi",
    "kind": "corporate",
    "classification": "corporate_out_of_state",
    "relation_class": "bosc_relation",
    "relation_basis": "Developer/land-assembler of the campus; grantee on the corridor deeds, applicant on the EPA/air permits (DOSSIER §2-§4)",
    "variants": [
      "BISTROZZI LLC",
      "BISTROZZI LLC, a Delaware limited liability company",
      "Bistrozzi",
      "Bistrozzi LLC",
      "Bistrozzi LLC, a Delaware Limited Liability Company"
    ],
    "signals": [
      "delaware"
    ],
    "roles": {
      "epa_applicant": 20,
      "grantee": 4,
      "firm": 3,
      "meeting_participant": 3
    },
    "parcels": [
      "36-0100-03-002.000",
      "36-1200-02-001.001",
      "36-1200-03-001.000",
      "36-1200-03-001.001",
      "36-1200-03-001.002",
      "36-1200-03-001.003",
      "36-1200-03-001.004",
      "36-1200-03-001.005",
      "36-1200-03-001.006",
      "36-1200-03-002.000",
      "36-1200-03-015.000"
    ],
    "addresses": [
      "1108 W BLUELICK RD",
      "1700 K Street, N.W., Fifth Floor, Washington, DC 20006-3817",
      "1700 K Street, NW, Fifth Floor, Washington, DC 20006-3817",
      "2801 Centerville Rd., Wilmington, DE 19808",
      "2801 Centerville Road, Wilmington, DE 19808",
      "2801 Centervillle Rd., Wilmington, DE 19808",
      "4110 N COLE ST",
      "4110 N COLE ST, LIMA, OH 45801",
      "4110 N Cole St, Lima, OH 45801",
      "52 East Gay Street, Columbus, OH 43215",
      "950 W BLUELICK RD",
      "COLE ST",
      "W BLUELICK RD"
    ],
    "sources": [
      "permits/3702676.epa.yaml",
      "permits/3727059.epa.yaml",
      "permits/3727544.epa.yaml",
      "permits/3788677.epa.yaml",
      "permits/3789048.epa.yaml",
      "permits/3796349.epa.yaml",
      "permits/3866942.epa.yaml",
      "permits/3949585.epa.yaml",
      "permits/3966517.epa.yaml",
      "permits/3969235.epa.yaml",
      "permits/3974496.epa.yaml",
      "permits/3977737.epa.yaml",
      "permits/3987141.epa.yaml",
      "permits/3987144.epa.yaml",
      "permits/4006230.epa.yaml",
      "permits/4007485.epa.yaml",
      "permits/4009043.epa.yaml",
      "permits/4074527.epa.yaml",
      "permits/4074529.epa.yaml",
      "permits/4074551.epa.yaml",
      "perry-township/meetings/meeting-summaries.yaml",
      "recorder/202508130008300.deed.yaml",
      "recorder/202508130008312.deed.yaml",
      "recorder/202508130008316.deed.yaml",
      "recorder/202603040002064.deed.yaml"
    ],
    "lei": null,
    "uei": null,
    "federal_obligations": null
  },
  {
    "key": "BISTROZZI ADDITION",
    "display": "Bistrozzi Addition LLC",
    "kind": "corporate",
    "classification": "corporate_out_of_state",
    "relation_class": "bosc_relation",
    "relation_basis": "Sibling Bistrozzi shell; grantee of the Pieper/Beery Road parcel (DOSSIER §11)",
    "variants": [
      "Bistrozzi Addition LLC"
    ],
    "signals": [
      "delaware"
    ],
    "roles": {
      "grantee": 1,
      "registrant": 1
    },
    "parcels": [
      "36-1100-04-001.001"
    ],
    "addresses": [
      "1337 BEERY RD"
    ],
    "sources": [
      "permits/sos-bistrozzi-addition-llc-2026-04-08.sos.yaml",
      "recorder/202604210003890.deed.yaml"
    ],
    "lei": null,
    "uei": null,
    "federal_obligations": null
  },
  {
    "key": "C T",
    "display": "C T Corporation",
    "kind": "corporate",
    "classification": "corporate_domestic",
    "relation_class": null,
    "relation_basis": null,
    "variants": [
      "C T Corporation"
    ],
    "signals": [],
    "roles": {
      "registered_agent": 1
    },
    "parcels": [],
    "addresses": [
      "4400 East Commons Way, Suite 125, Columbus, OH 43219"
    ],
    "sources": [
      "permits/sos-bistrozzi-addition-llc-2026-04-08.sos.yaml"
    ],
    "lei": null,
    "uei": null,
    "federal_obligations": null
  },
  {
    "key": "CENOVUS ENERGY",
    "display": "Cenovus Energy Inc.",
    "kind": "corporate",
    "classification": "corporate_parent",
    "relation_class": null,
    "relation_basis": null,
    "variants": [
      "Cenovus Energy Inc."
    ],
    "signals": [],
    "roles": {},
    "parcels": [],
    "addresses": [],
    "sources": [
      "data/reference/gleif/lei-records.yaml"
    ],
    "lei": "254900LJGL2N2XEMD470",
    "uei": null,
    "federal_obligations": null
  }
]
