[
  {
    "key": "AMAZON DATA SERVICES",
    "display": "Amazon Data Services, Inc.",
    "kind": "corporate",
    "classification": "corporate_domestic",
    "relation_class": null,
    "relation_basis": null,
    "variants": [
      "Amazon Data Services, Inc."
    ],
    "signals": [],
    "roles": {
      "epa_applicant": 4,
      "applicant": 2
    },
    "parcels": [],
    "addresses": [
      "1812 Boren Ave, Seattle, WA",
      "410 Terry Ave N, Seattle, WA 98109"
    ],
    "sources": [
      "oepa/sidney/1GC10596.approval.npdes.yaml",
      "oepa/sidney/1GC10596.noi.npdes.yaml",
      "oepa/sidney/DSW401251911W.epa.yaml",
      "oepa/sidney/DSW401262560W.epa.yaml",
      "oepa/sidney/DSW401262560W.iwp-application.epa.yaml",
      "oepa/sidney/DSWPTI-260517.epa.yaml"
    ],
    "lei": null,
    "uei": null,
    "federal_obligations": null
  },
  {
    "key": "GENERAL DYNAMICS",
    "display": "GENERAL DYNAMICS CORPORATION",
    "kind": "corporate",
    "classification": "corporate_defense",
    "relation_class": null,
    "relation_basis": null,
    "variants": [
      "GENERAL DYNAMICS CORPORATION"
    ],
    "signals": [],
    "roles": {},
    "parcels": [],
    "addresses": [],
    "sources": [
      "data/reference/gleif/lei-records.yaml"
    ],
    "lei": "9C1X8XOOTYY2FNYTVH06",
    "uei": null,
    "federal_obligations": null
  },
  {
    "key": "GENERAL DYNAMICS LAND SYSTEMS",
    "display": "General Dynamics Land Systems Inc.",
    "kind": "corporate",
    "classification": "corporate_defense",
    "relation_class": null,
    "relation_basis": null,
    "variants": [
      "General Dynamics Land Systems Inc."
    ],
    "signals": [],
    "roles": {
      "jsmc_operator": 1
    },
    "parcels": [],
    "addresses": [],
    "sources": [
      "data/reference/gleif/lei-records.yaml"
    ],
    "lei": "875500ULXB4CYQSJVA03",
    "uei": null,
    "federal_obligations": null
  },
  {
    "key": "GEORGE IGEL &",
    "display": "George J. Igel & Co., Inc.",
    "kind": "corporate",
    "classification": "corporate_domestic",
    "relation_class": null,
    "relation_basis": null,
    "variants": [
      "George J. Igel & Co., Inc."
    ],
    "signals": [],
    "roles": {
      "applicant": 1
    },
    "parcels": [],
    "addresses": [],
    "sources": [
      "oepa/sidney/1GC10596.copermittee-igel.npdes.yaml"
    ],
    "lei": null,
    "uei": null,
    "federal_obligations": null
  },
  {
    "key": "SMART SERVICES",
    "display": "Smart Services, Inc",
    "kind": "corporate",
    "classification": "corporate_domestic",
    "relation_class": null,
    "relation_basis": null,
    "variants": [
      "Smart Services, Inc"
    ],
    "signals": [],
    "roles": {
      "firm": 3
    },
    "parcels": [],
    "addresses": [],
    "sources": [
      "oepa/sidney/DSW401251911W.epa.yaml",
      "oepa/sidney/DSW401262560W.epa.yaml",
      "oepa/sidney/DSW401262560W.iwp-application.epa.yaml"
    ],
    "lei": null,
    "uei": null,
    "federal_obligations": null
  },
  {
    "key": "npdes:1PD00009",
    "display": "City of Sidney WWTP",
    "kind": "facility",
    "classification": "facility",
    "relation_class": null,
    "relation_basis": null,
    "variants": [
      "City of Sidney WWTP"
    ],
    "signals": [],
    "roles": {
      "facility": 1
    },
    "parcels": [],
    "addresses": [],
    "sources": [
      "oepa/sidney/1PD00009.npdes.yaml"
    ],
    "lei": null,
    "uei": null,
    "federal_obligations": null
  },
  {
    "key": "CITY OF SIDNEY",
    "display": "City of Sidney",
    "kind": "government",
    "classification": "government_local",
    "relation_class": null,
    "relation_basis": null,
    "variants": [
      "City of Sidney"
    ],
    "signals": [],
    "roles": {
      "applicant": 1,
      "epa_applicant": 1
    },
    "parcels": [],
    "addresses": [
      "201 W Poplar Street, Sidney, OH 45365"
    ],
    "sources": [
      "oepa/sidney/1PD00009.npdes.yaml",
      "oepa/sidney/DSW401252256W.epa.yaml"
    ],
    "lei": null,
    "uei": null,
    "federal_obligations": null
  },
  {
    "key": "ALEXANDER RECK DBA HIDDEN VALLEY MHP",
    "display": "Alexander R. Reck dba Hidden Valley MHP",
    "kind": "individual",
    "classification": "individual",
    "relation_class": null,
    "relation_basis": null,
    "variants": [
      "Alexander R. Reck dba Hidden Valley MHP"
    ],
    "signals": [],
    "roles": {
      "applicant": 1
    },
    "parcels": [],
    "addresses": [],
    "sources": [
      "oepa/sidney/1PV00037.npdes.yaml"
    ],
    "lei": null,
    "uei": null,
    "federal_obligations": null
  },
  {
    "key": "CHRIS KLEIN",
    "display": "Chris Klein",
    "kind": "individual",
    "classification": "individual",
    "relation_class": null,
    "relation_basis": null,
    "variants": [
      "Chris Klein"
    ],
    "signals": [],
    "roles": {
      "permit_contact": 3
    },
    "parcels": [],
    "addresses": [],
    "sources": [
      "oepa/sidney/DSW401251911W.epa.yaml",
      "oepa/sidney/DSW401262560W.epa.yaml",
      "oepa/sidney/DSW401262560W.iwp-application.epa.yaml"
    ],
    "lei": null,
    "uei": null,
    "federal_obligations": null
  },
  {
    "key": "CLUNE CONSULTING SERVICES",
    "display": "Clune Consulting Services",
    "kind": "individual",
    "classification": "individual",
    "relation_class": null,
    "relation_basis": null,
    "variants": [
      "Clune Consulting Services"
    ],
    "signals": [],
    "roles": {
      "firm": 1
    },
    "parcels": [],
    "addresses": [],
    "sources": [
      "oepa/sidney/DSW401252256W.epa.yaml"
    ],
    "lei": null,
    "uei": null,
    "federal_obligations": null
  },
  {
    "key": "LAURA MARKMAN",
    "display": "Laura Markman",
    "kind": "individual",
    "classification": "individual",
    "relation_class": null,
    "relation_basis": null,
    "variants": [
      "Laura Markman"
    ],
    "signals": [],
    "roles": {
      "permit_contact": 1
    },
    "parcels": [],
    "addresses": [],
    "sources": [
      "oepa/sidney/4214600.epa.yaml"
    ],
    "lei": null,
    "uei": null,
    "federal_obligations": null
  },
  {
    "key": "MARCUS MOAN",
    "display": "Marcus Moan",
    "kind": "individual",
    "classification": "individual",
    "relation_class": null,
    "relation_basis": null,
    "variants": [
      "Marcus Moan"
    ],
    "signals": [],
    "roles": {
      "permit_contact": 1
    },
    "parcels": [],
    "addresses": [],
    "sources": [
      "oepa/sidney/DSW401252256W.epa.yaml"
    ],
    "lei": null,
    "uei": null,
    "federal_obligations": null
  },
  {
    "key": "npdes:1GC10596",
    "display": "Sidney Data Center Campus",
    "kind": "individual",
    "classification": "individual",
    "relation_class": null,
    "relation_basis": null,
    "variants": [
      "Sidney Data Center Campus"
    ],
    "signals": [],
    "roles": {
      "facility": 3
    },
    "parcels": [],
    "addresses": [],
    "sources": [
      "oepa/sidney/1GC10596.approval.npdes.yaml",
      "oepa/sidney/1GC10596.copermittee-igel.npdes.yaml",
      "oepa/sidney/1GC10596.noi.npdes.yaml"
    ],
    "lei": null,
    "uei": null,
    "federal_obligations": null
  },
  {
    "key": "npdes:1PV00037",
    "display": "Hidden Valley Mobile Home Park",
    "kind": "individual",
    "classification": "individual",
    "relation_class": null,
    "relation_basis": null,
    "variants": [
      "Hidden Valley Mobile Home Park"
    ],
    "signals": [],
    "roles": {
      "facility": 1
    },
    "parcels": [],
    "addresses": [],
    "sources": [
      "oepa/sidney/1PV00037.npdes.yaml"
    ],
    "lei": null,
    "uei": null,
    "federal_obligations": null
  },
  {
    "key": "GREAT MIAMI RIVER",
    "display": "Great Miami River",
    "kind": "water",
    "classification": "receiving_water",
    "relation_class": null,
    "relation_basis": null,
    "variants": [
      "Great Miami River"
    ],
    "signals": [],
    "roles": {
      "receiving_water": 1
    },
    "parcels": [],
    "addresses": [],
    "sources": [
      "oepa/sidney/1PD00009.npdes.yaml"
    ],
    "lei": null,
    "uei": null,
    "federal_obligations": null
  },
  {
    "key": "MILL CREEK",
    "display": "Mill Creek",
    "kind": "water",
    "classification": "receiving_water",
    "relation_class": null,
    "relation_basis": null,
    "variants": [
      "Mill Creek"
    ],
    "signals": [],
    "roles": {
      "receiving_water": 1
    },
    "parcels": [],
    "addresses": [],
    "sources": [
      "oepa/sidney/1GC10596.noi.npdes.yaml"
    ],
    "lei": null,
    "uei": null,
    "federal_obligations": null
  },
  {
    "key": "TAWAWA CREEK",
    "display": "Tawawa Creek",
    "kind": "water",
    "classification": "receiving_water",
    "relation_class": null,
    "relation_basis": null,
    "variants": [
      "Tawawa Creek"
    ],
    "signals": [],
    "roles": {
      "receiving_water": 1
    },
    "parcels": [],
    "addresses": [],
    "sources": [
      "oepa/sidney/1PV00037.npdes.yaml"
    ],
    "lei": null,
    "uei": null,
    "federal_obligations": null
  }
]
